{
  "$schema": "https://github.com/BotShelfVampire/botshelf-ai-team-registry/blob/main/docs/directory-route-status.schema.json",
  "schemaVersion": "1.0",
  "lastUpdated": "2026-09-29",
  "timeZone": "Asia/Tokyo",
  "purpose": "Machine-readable directory route audit status for de-duplication, fee control, product-surface separation, and externally verifiable lifecycle tracking.",
  "countingRule": "An audit or prepared package is not a submission, acceptance, or publication. Count a submitted or published state only when a confirmation receipt or live URL is independently observable.",
  "surfaceSeparation": {
    "marketplace": "https://botshelfvampire.com/",
    "buildLibrary": "https://botshelfvampire.com/library/",
    "distinct": true
  },
  "routeCount": 16,
  "summary": {
    "byZeroCostClassification": {
      "verified-free": 10,
      "conditional-free": 1,
      "unverified": 2,
      "temporarily-unavailable": 1,
      "paid-only": 2
    },
    "submitted": 0,
    "accepted": 0,
    "published": 0
  },
  "routes": [
    {
      "id": "launching-next",
      "name": "Launching Next",
      "proposedSurface": "build-library",
      "zeroCostPath": {
        "classification": "verified-free",
        "description": "Standard submission is free; the optional $99 fast-track is excluded.",
        "currentlyActionable": true
      },
      "lifecycle": {
        "audited": true,
        "prepared": true,
        "submitted": false,
        "accepted": false,
        "published": false
      },
      "automation": {
        "automatedSubmissionPermitted": false,
        "manualOwnerActionRequired": true,
        "reason": "Final submission transmits an approved contact identity and requires action-time owner confirmation."
      },
      "blocker": "Approved contact identity, duplicate/history check, and owner confirmation remain unresolved.",
      "nextAction": "Recheck the official free route, duplicate state, contact identity, and fee before one authorized submission.",
      "audit": {
        "path": "docs/launching-next-submission.md",
        "url": "https://github.com/BotShelfVampire/botshelf-ai-team-registry/blob/main/docs/launching-next-submission.md"
      },
      "paidAlternativesExcluded": true,
      "externalEvidence": {
        "confirmationReceipt": null,
        "liveUrl": null
      }
    },
    {
      "id": "product-hunt",
      "name": "Product Hunt",
      "proposedSurface": "marketplace",
      "zeroCostPath": {
        "classification": "verified-free",
        "description": "The standard Product Hunt launch is officially free; optional advertising and managed campaigns are excluded.",
        "currentlyActionable": true
      },
      "lifecycle": {
        "audited": true,
        "prepared": true,
        "submitted": false,
        "accepted": false,
        "published": false
      },
      "automation": {
        "automatedSubmissionPermitted": false,
        "manualOwnerActionRequired": true,
        "reason": "A personal maker account, approved assets, first comment, and exact launch schedule require owner-controlled action."
      },
      "blocker": "Authorized account history, maker identity, approved assets, and final owner-approved launch date remain unresolved.",
      "nextAction": "Use only the free launch path after checking private drafts and prior domain launches, approving assets and identity, and confirming the exact schedule.",
      "audit": {
        "path": "docs/product-hunt-route-audit.md",
        "url": "https://github.com/BotShelfVampire/botshelf-ai-team-registry/blob/main/docs/product-hunt-route-audit.md"
      },
      "paidAlternativesExcluded": true,
      "externalEvidence": {
        "confirmationReceipt": null,
        "liveUrl": null
      }
    },
    {
      "id": "hacker-news",
      "name": "Hacker News / Show HN",
      "proposedSurface": "build-library",
      "zeroCostPath": {
        "classification": "verified-free",
        "description": "The ordinary official submit route requires an account but presents no fee or checkout; vote solicitation and paid visibility are excluded.",
        "currentlyActionable": true
      },
      "lifecycle": {
        "audited": true,
        "prepared": true,
        "submitted": false,
        "accepted": false,
        "published": false
      },
      "automation": {
        "automatedSubmissionPermitted": false,
        "manualOwnerActionRequired": true,
        "reason": "Show HN requires a maker who personally worked on the project, is available to discuss it, and does not post generated or AI-edited comments."
      },
      "blocker": "Authorized account history, maker identity, and human availability for authentic discussion are unverified; the prepared comment must be independently rewritten by the maker.",
      "nextAction": "An owner-authorized maker should perform the final duplicate and fee checks, rewrite the comment in their own words, post once, and never solicit votes or comments.",
      "audit": {
        "path": "docs/hacker-news-route-audit.md",
        "url": "https://github.com/BotShelfVampire/botshelf-ai-team-registry/blob/main/docs/hacker-news-route-audit.md"
      },
      "paidAlternativesExcluded": true,
      "externalEvidence": {
        "confirmationReceipt": null,
        "liveUrl": null
      }
    },
    {
      "id": "microlaunch",
      "name": "Microlaunch",
      "proposedSurface": "build-library",
      "zeroCostPath": {
        "classification": "unverified",
        "description": "The public pages distinguish a Regular launch from paid plans but do not confirm that Regular costs $0.",
        "currentlyActionable": false
      },
      "lifecycle": {
        "audited": true,
        "prepared": true,
        "submitted": false,
        "accepted": false,
        "published": false
      },
      "automation": {
        "automatedSubmissionPermitted": false,
        "manualOwnerActionRequired": true,
        "reason": "Authenticated Product HQ must confirm a zero-dollar Regular route."
      },
      "blocker": "Official $0 status and private draft history are unverified.",
      "nextAction": "Proceed only if the authenticated live route explicitly shows $0 and no duplicate exists.",
      "audit": {
        "path": "docs/microlaunch-route-audit.md",
        "url": "https://github.com/BotShelfVampire/botshelf-ai-team-registry/blob/main/docs/microlaunch-route-audit.md"
      },
      "paidAlternativesExcluded": true,
      "externalEvidence": {
        "confirmationReceipt": null,
        "liveUrl": null
      }
    },
    {
      "id": "alternativeto",
      "name": "AlternativeTo",
      "proposedSurface": "marketplace",
      "zeroCostPath": {
        "classification": "verified-free",
        "description": "The standard review queue is free; paid priority review is excluded.",
        "currentlyActionable": true
      },
      "lifecycle": {
        "audited": true,
        "prepared": true,
        "submitted": false,
        "accepted": false,
        "published": false
      },
      "automation": {
        "automatedSubmissionPermitted": false,
        "manualOwnerActionRequired": true,
        "reason": "Sign-in and approved contact details are required for submission."
      },
      "blocker": "Authenticated duplicate and draft history plus final owner confirmation remain unresolved.",
      "nextAction": "Use only the standard free queue after authenticated duplicate and fee checks.",
      "audit": {
        "path": "docs/alternativeto-submission.md",
        "url": "https://github.com/BotShelfVampire/botshelf-ai-team-registry/blob/main/docs/alternativeto-submission.md"
      },
      "paidAlternativesExcluded": true,
      "externalEvidence": {
        "confirmationReceipt": null,
        "liveUrl": null
      }
    },
    {
      "id": "dev-hunt",
      "name": "Dev Hunt",
      "proposedSurface": "build-library",
      "zeroCostPath": {
        "classification": "conditional-free",
        "description": "A launch week is free only while it contains fewer than 15 tools; otherwise the week shows $49.",
        "currentlyActionable": false
      },
      "lifecycle": {
        "audited": true,
        "prepared": true,
        "submitted": false,
        "accepted": false,
        "published": false
      },
      "automation": {
        "automatedSubmissionPermitted": false,
        "manualOwnerActionRequired": true,
        "reason": "Live authenticated capacity can change before submission."
      },
      "blocker": "Current free-week inventory and private draft history are unverified.",
      "nextAction": "Proceed only if the authenticated selector still shows a $0 week at submission time.",
      "audit": {
        "path": "docs/devhunt-route-audit.md",
        "url": "https://github.com/BotShelfVampire/botshelf-ai-team-registry/blob/main/docs/devhunt-route-audit.md"
      },
      "paidAlternativesExcluded": true,
      "externalEvidence": {
        "confirmationReceipt": null,
        "liveUrl": null
      }
    },
    {
      "id": "saashub",
      "name": "SaaSHub",
      "proposedSurface": "build-library",
      "zeroCostPath": {
        "classification": "verified-free",
        "description": "The normal submission tool is officially described as free; Featured Product at $99 per month is excluded.",
        "currentlyActionable": true
      },
      "lifecycle": {
        "audited": true,
        "prepared": true,
        "submitted": false,
        "accepted": false,
        "published": false
      },
      "automation": {
        "automatedSubmissionPermitted": false,
        "manualOwnerActionRequired": true,
        "reason": "Final ownership, category, duplicate, and account-history checks are required."
      },
      "blocker": "Account-level duplicate history and final ownership details remain unresolved.",
      "nextAction": "Use only the normal free form after final checks.",
      "audit": {